id,question,answer
435,"Nuestra Belleza México 2010 was crowned by the winner of what other 2010 pageant, the winner of which was crowned on 23 August 2010?",Miss Universe 2010
436,Peter Curtis and Scott Draper are both what?,former tennis player
437,Armie Hammer stars as Oliver in a film directed by who ?,Luca Guadagnino
438,When did the British philosopher whose works inspired Kate Horsley's interest in Zen die?,16 November 1973
439,"This stadium, the largest in eastern Europe, was home to the 1998 IAAF Grand Prix Final.  How many seats does it have?","81,000 seats"
440,"When was the anthology, in which fisrt pages of The Incal"" were released, created?",December 1974
441,Figure 2 Ranch Airport supports launch operations of what aerospace manufacturer and space flight services company?,Blue Origin
442,"When did the University, of which The Dove Marine Laboratory is a part, gain University status ? ?",1963
443,What was the address of the penitentiary where Jimmy Elliot was sentenced?,2027 Fairmount Avenue
444,Who produced the film that was Jennifer Kent's directorial debut?,Kristina Ceyton and Kristian Moliere
445,Lee Sung-jae stars in the film Barking Dogs Never Bite which is what film genre?,comedy-drama
446,"In the seventh-largest country in Africa, what is the oil prodcution of the city at the mouth of the Congo River?",1200000 oilbbl/d
447," Which 1970's film was released first, Charley and the Angel or The Boatniks?","The Boatniks is a 1970 American comedy film starring Robert Morse, Stefanie Powers, Don Ameche and Phil Silvers."
448,Not About Angels was used in the film adaptation of what novel by John Green?,The Fault in Our Stars
449,"What year was the film ""Mom"" released, starring the voice of Shashaa Tirupati?",2017
450,What bluegrass singer provides vocals for a song on the album which was released in September 2013 through PRMD Music?,Dan Tyminski
451,Which player signed to Bayern Munich before the 2012-2013 season was known mostly as a central defender?,Dante
452,David Huntsinger has worked with this gospel singer born in the month of July?,Larnelle Harris
453,"The younger brother, who became king, of Princess Mafalda of Savoy reigned for how many days?",34 days
454,Which actor that has performed as Inspector Javert in a Les Misérables production Has won the Laurence Olivier Award for Best Actor in a musical three times?,Philip Quast
455,Of which band was the singer who released the record I Get Weak once a member ?,"The Go-Go's,"
456,Which of the following buildings was designed by SHoP Architects: 247 Cherry or General Motors Building?,247 Cherry
457,Wheelock Whitney is just one member of the Whitney Family. Where did this American family originate from?,"London, England"
458,"Midland F1 Racing was a racing team that, in 2007, competed under what name for sponsorship reasons?",Spyker F1
459,Giselle Cossard was known as Mother Giselle of what type of diety?,major water deity
460,Which of the teams that Sun-woo Kim played on never won a division title?,Colorado Rockies
461,What studio album did Kanye West record with Roc-A-Fella Records and soul singer Dwele?,My Beautiful Dark Twisted Fantasy
462,What team plays within the Big 12 Conference and has Kevin Bookout playing for them?,Oklahoma Sooners men's basketball
463,What is the first two words of the fifth studio album of Joseph Edgar Foreman?,The Hungry
464,In what year was the soft drink that the Coca-Cola Company designed Red Flash to compete against created?,1937
465,"Which ""The Chronicles of Narnia"" character is prominently featured in ""The Lion, the Witch and the Wardrobe"" and is a close friend with Lucy Pevensie whom she meets in the Lantern Waste.",Mr. Tumnus
466,J.B. Scotts located on this 11 mile stretch in Albany New York and is also known by this name in Schenectady County?,State Street
467,What county in Minnesota holds a 202 lb slab of greywacke covered in runes?,Douglas
468, What annual event occurs on a property co-founded by an American who was the best-selling recording artist of the 20th century?,San Diego County Fair
469,What is the name of the fashion label that the founder of the Faena Arts Center founded in 1985?,Via Vai
470,What championship did the person who substituted for Simon Pagenaud secure a contract to drive in 2017?,Australian Supercars Championship
471,Are both Barry Unsworth and P. G. Wodehouse from the same country?,yes
472,To which taxonomic category do both Hyacinthoides and Anthriscus belong?,genus
473,"Which town has a greater population as of the 2010 census, Minden, Nevada or Gardnerville, Nevada?",Gardnerville
474,"Which is in the pop genre, Capital Cities or Tweaker?",Capital Cities
475,What Canadian filmmaker created a film about Bettie Page in 2005?,"Mary Harron (born January 12, 1953)"
476,What movement was the the person referred to as Mumia part of?,black nationalism
477,"Which restaurant chain is based further south, Pizza Fusion or Imo's Pizza?",Pizza Fusion
478,"Which restaurant was founded first, Papa Murphy's or Gino's Pizza and Spaghetti?",Gino's Pizza and Spaghetti
479,"Which team was older when it had it's worst season, The Cleveland Browns or the Detroit Lions",Detroit Lions
480,The first Latina Supreme Court Justice was part of the majority decision of a case that upheld which previous supreme court case?,Apprendi v. New Jersey
481,Which Australian professional women's basketball team has an American playing in it?,Adelaide Lightning
482,What singer who was the seventh place finalist on the 7th season of American Idol first recorded the song Like My Mother Does,Kristy Lee Cook
483,PISCES was developed by the company that is headquartered in what city?,"McLean, Virginia"
484,What supernatural horror film did Miles Doleac have a role in?,Sleepy Hollow
485,Which publisher released the prequel to the 2012 novel Boneland in 1960?,Sir William Collins
486,"This work of literature _______ , known by its Greek title Oedipus Tyrannus was argued by Sigmund Freud to be one of the greatest works of world literature in his 1928 article. ",Oedipus Rex
487,"In what century did this Native warrior and chief, whose brother Tenskwatawa led the Tippecanoe order of battle, become the primary leader of a large, multi tribal confederacy?",nineteenth
488,"In what year was the novel that Lourenço Mutarelli based ""Nina"" on based first published?",1866
489,Are Control Room and Meeting Resistance both documentary films that involve Iraq?,yes
490,"Which writer died later, Agatha Christie or Clement Greenberg?",Clement Greenberg
491,"Does Jimmy Barnes have more hits, both solo and in a group, than Yang Seung-ho has with his group?",yes
492,Where did the designer of the Van de Graaff generator teach at?,Princeton University and Massachusetts Institute of Technology
493,Are Yucca and Rodgersia both perennials?,yes
494,What is the nationality of the poet who wrote Une Tempete and first performed it in Tunisia?,French
495,"The Declaration of Montreal was the founding document of which world event, lasting from July 26-August 5, 2006?",The 1st World Outgames
496,The Roissy Airport connects to Paris and cities in what countries?,"in France, as well as to Belgium"
497,What city did the Freebooters F.C. soccer team lose in that is now known as Croke Park?,Dublin
498,Are Chlidanthus and Maianthemum both flowering plants?,yes
499,Were both Life magazine and Strictly Slots magazine published monthly in 1998?,yes
500,"Which was Disney's 2nd animated production, Pinocchio or Home on the Range?",Pinocchio
501,What city does Paul Clyne and David Soares have in common?,New York
502,Black Book starred the actress and writer of what heritage?,Dutch
503,In what year did the parent show of The URL with Phred Show end?,2002
504,What is the birthday of the Earl of Merioneth?,10 June 1921
505,"What novella was ""Eyes Wide Shut,"" starring Vinessa Elizabeth Shaw, based on?","""Traumnovelle"" (""Dream Story"")"
506,Whose helmet is it discovered in 1939 which is well preserved and together with the Coppergate Helmet?,is widely believed to have been the helmet of King Rædwald of East Anglia
507,"The 1996 film ""The Christmas Tree"" stars Andrew McCarthy and an actress that has won how any Emmy Awards?",three
508,"In what city is the mortgage lending company, founded by Dan Gilbert, headquartered?","Detroit, Michigan"
509,What is the nickname of the peninsula that is home to the Calabrian Black Squirrel?,"""lo Stivale"" (the Boot)"
510,Are Dogo Cubano and the Dutch Shepherd both breeds of dog?,yes
511,"Are Jiujiang, Guangdong and Ruzhou located in the same Chinese district?",no
512,What position does Kyle York hold at the internet performance management company Dyn?,Chief Strategy Officer
513,Is Edison Sault Power Canal somehow linked with or used with the Cayuga–Seneca Canal?,no
514,What is type of philosophies is The Structure of Liberty about?,political
515,The director of a film about Wong Fei-hung also made what film? ,"""The 36th Chamber of Shaolin"""
516,What sort of activist is the author of The Irrational Atheist? ,alt-right
517,Are PC Magazine and Sculptural Pursuit both technology publications?,no
518,"What film, based on the book “Boston Strong”, featured the actress Alex McKenna?",Patriots Day
519,"George H. W. Bush,  a resident of West Oaks Subdivision in Houston Texas, became what number President in 1989? ",41st
520,"what is the group called that Dianne Morgan and Joe Wilkinson a part of in the BBC comedy ""Two Episodes of Mash""",the deadpan sketch group
521,"What singer-songwriter from Derry appeared on Paul van Dyk's 2012 album, Evolution?",Johnny McDaid
522,"Which airport is busier, Palm Springs International Airport or Trenton–Mercer Airport?",Trenton–Mercer Airport
523,"The thid episode of the first season of The Simpsons, features which character voiced by Harry Shearer?",Mr. Smithers
524,Which casino closed first The Atlantic Club Casino Hotel or Trump Plaza Hotel and Casino ? ,The Atlantic Club Casino Hotel
525,To what sport does the Atomweight class belong?,mixed martial arts
526,Were Cinderella and The Emperor's New Groove released by the same picture company?,no
527,Viscount Yamaji Motoharu was a general in the early Imperial Japanese Army which belonged to which Empire?,Empire of Japan
528,Boggle is a word game originally distributed by a toy and game manufacturer that published more than how many games?,"1,800"
529,Of these two publication--Báiki and Sick--what type of publication is the one that was published most frequently? ,satirical-humor magazine
530,In which county does the  8th Military Police Brigade  of the United States Army's Barracks located?,Honolulu
531,What magazine was started in 1925 and features the work of Barry Werth?,The New Yorker
532,Kenneth Arnold reported the first unidentified object sighting in what city and state in 1947?,"Mount Rainier, Washington"
533,Hina is derived from a dye prepared in what areas?,South Asia and the Middle East
534,"The title track of Carla Bruni discography was used in a  film directed by James Ivory, and was also used in what other film?",(500) Days of Summer
535,What country do both Adnan Akmal and Kamran Akmal represent in cricket?,Pakistani
536,Woodland is a census-designated place in a town that had this population as of the 2010 census?,"1,521"
537,When did the author of the book One More River is based on win the Nobel Prize?,1932
538,"The NG postcode area is situated approximately how many miles from Gamston, Rushcliffe?",approximately 3 mi
539,William Bromley-Davenport held political office under the Prime Minister who was of which party?,Conservative
540,What is the nationality of the author of Fifty Shades Freed?,English
541,Are both Grapico and Izze artificially flavored soft drinks?,no
542,Which Canadian Professional ice hockey player of Albanian origin bought in on the deal for the Ontario Raiders?,Tie Domi
543,Zacarías Ferreira is the uncle of a professional basketball player who played college basketball for who?,University of Kentucky
544,Do both Changle District and Longkou face water?,yes
545,What job do both Alfred Santell and David Fincher have in common?,director
546,Which reservation is located in Hill and Chouteau and named after the principal leader of the Montana Chippewa-Cree?,Rocky Boy's Indian Reservation
547,"In which Florida city is Skyplex being constructed, featuring Skyscraper, the tallest rollercoaster in the world?",Orlando
548,What is the name of one the Italian Navy's new warship?,"PPA, Pattugliatore Polivalente d'Altura"
549,"How many small-box format stores are there for one of Newell Brands' brand that sells scented candles, candleholders, accessories, and dinnerware?",560
550,Jimmy D'Arcy played in Northern Ireland for the team based in what county?,Antrim
551,"Which was published more frequently, Popular Science or Girlfriends?",Girlfriends
552,"Who was born first, Martin Degville or Richie Furay?","""Richie"" Furay"
553,What is the 2010 census population of the county where Wildcat Brook flows through Jackson?,"47,818"
554,"Which came out first, Dinosaur or McFarland, USA",Dinosaur
555,"In which city did he painter and printmaker associated with ""Les Nabis"" found Salon d'Automne?",Paris
556,What is the call sign of the airline that operates the flight with United Express Flight 3411 incident?,Brickyard
557,The man who currently serves as the wide receivers coach for the Dallas Cowboys used to coach at what college?,Louisiana Tech
558,"In what year did the actor who starred in the TV Land original series ""The Soul Man"" host the Black Movie Awards?",2005
559,My Secret Hotel is a television series starring a South Korean DJ who rose to fame as the lead actress in what?,Queen In-hyun's Man
560,Mía Maestro had a role in the 2002 biopic directed by whom?,Julie Taymor
561,"The Simpsons episode that aired on February 19, 2012 entitled ""At Long Last Leave"" represented what milestone for the show? ",show's 500th episode
562,What sibling of John D. Rockefeller III was the chairman of Chase Manhattan Corporation?,David Rockefeller
563,The Album Against the Wind was the 11th Album of a Rock singer Robert C Seger born may 6 1945. What was the Rock singers stage name ?,Bob Seger
564,In what city does a Christian minister who won the singles title with Jan Kodes in the 1970 French Open currently reside?,"Perth, Western Australia"
565,"Which rock band chose its name by drawing it out of a hat, Switchfoot or Midnight Oil?",Midnight Oil
566,"What character did G.D. Spradlin's collaborator Marlon Brando portray in ""On the Waterfront""?",Terry Malloy
567, If You Ever Get Lonely was covered by what Lyric Street Records-affiliated band?,Love and Theft
568,"Which genus has more species, Azorina or Azadirachta?",Azadirachta
569,Heath Ledger Australian actor was in the movie Brokeback Mountain directed by who?,Ang Lee
570,Daddy was an American Pit Bull who was integral to the work of what Mexican-American dog behaviorist with over 25 years of canine experience?,Cesar Millan
571,Who is the father of the king who attempted to have Eardwulf assassinated,Æthelwald Moll
572,"Howard Bilerman produced an album for which songwriter from Athens, Georgia?",Vic Chesnutt
573,Who co-founded View Askew Productions and produced numerous movies starring Jason Lee?,Kevin Smith
574,Which author wrote about a woman captured by the Symbionese Liberation Army?,Paul Avery
575,"Football at the 2006 Asian Games with Wisoon Wichaya as its coach was played how many days prior to the opening ceromony in Doha, Qatar in 2006? ",14
576,"Which of the steering committee was an American broadcast journalist, best known as anchorman for the ""CBS Evening News"" for 19 years?",Walter Cronkite
577,What was the occupation of the man who published an individualist anarchist journal?,American schoolteacher and publisher
578,Who did a new permanent member on the fourteenth season of  So You Think You Can Dance play in High School Musical?,Gabriella Montez
579,"Which amusement park at Coney Island, Brooklyn, New York City,  without being the grandest, was the island's longest lasting?",Steeplechase Park
580,Richard Münch portrayed the German general who served in what capacity during WWII in the 1970 movie Patton?,Oberkommando der Wehrmacht
581,"Cordyline ruba grows from Bundaberg, Queensland to which northeastern city in New South Whales, Australia?",Lismore
582,"When was the American singer, songwriter, record producer, dancer and actress born who's second studio album is Chapter II?","October 13, 1980"
583,What type of structure does 277 Park Avenue and 126 Madison Avenue have in common?,building
584,Anna Lewandowska is married to a footballer who plays for what club?,Bayern Munich
585,What city is the army division that conducted Operation Blue Hearts in the Korean War based out of?,"Fort Hood, Texas"
586,Who was born in Ireland and has coached the captain of MLS club Colorado Rapids?,Des McAleenan
587,What record company does distribution for Joan Marie Larkin and Kenny Laguna?,Blackheart Records
588,where was the 2006 Commonwealth Games that Mmoloki Nogeng won a bronze medal at held?,"Melbourne, Australia"
589,"Whose native growing land is more south, Beech or Daviesia?",Daviesia
590,"In the muti-sport games usually held every four years between nations around the Mediterranean Sea, Fatma Lanouar is best known for winning gold in which event?",1500 metres
591,Is It Just Me? was a single by the English rock band from what Suffolk city?,Lowestoft
592,"How many records did the boy band who released ""Said and Done"" sell worldwide as of 2013?",25 million
593,"What is the name of the region that includes the cities Dover and Portsmouth, New Hampshire?",Seacoast Region
594,Mr. & Mrs. Mxyzptlk is an episode of the superhero TV series that originally aired on what network?,CBS
595,When was the plaintiff in the 1892 Barbed Wire Patent Case born?,"January 18, 1813"
596,Atlanta Zero Mile Post is located within a historic area opened in what year ?,1969
597,What team won the XLII super bowl in their 48th overall season?,2007 New England Patriots
598,Kang Sung-yeon played Prince Yeonsan in a film that runs for how many minutes ?,119 minutes
599,What are the colors of the tricolour flag that was adopted in 1919?,"green (at the hoist), white and orange"
600,An cricket star who played a supporting role in the film Sinhawalokanaya was a former captain of which cricket team?,Sri Lanka national cricket team
601,Armageddon in Retrospect was written by the author who was best known for what 1969 satire novel?,Slaughterhouse-Five
602,What do Wrigley Park and social networks have in common?,Neighbourhood
603,Which voice actor plays the voice of the cartoon character that is most famous for his semi-intelligible speech and his mischievous and temperamental personality?,Clarence Nash
604,"What event in 1920 was established by the director of the play ""The Miracle?""",Salzburg Festival
605,Who was the brother of the wife of the Democratic Party nomination for Vice President in 1972?,President John F. Kennedy
606,What type of product is the sponsor of the Premiership Rugby Sevens SeriesSeries ? ,pale lager
607,When was Erik Watts' father born?,"May 5, 1939"
608,"When was one of the fresco mural, one of the greatest treasures of the Hood Museum of Art, painted?",between 1932 and 1934
609,"Love Child is a 1982 biopic starring Beau Bridges, Mackenzie Phillips, and an actress that was nominated for the Academy Award for Best Supporting Actress for what 1985 film? ","""Twice in a Lifetime"""
610,Ho Iat Seng  is a member of a legislative assembly that has how many members ?,33-member
611,How many times has the team Jack McKeon managed won the World Series?,two World Series championships
612,are Tinto Brass and Baltasar Kormákur both from the same country ?,no
613,Who is younger Kirk Humphreys or Tom Coburn?,Kirk Humphreys
614,The head writer for which show also wrote a Simpsons' episode narrated by James Earl Jones?,Futurama
615,"Which singer has been in more music bands, Michael Crafter or Martin Degville?",Michael Crafter
616,Who is prime minister of this West African country that covers 36125km2?,Umaro Mokhtar Sissoco Embaló
617,"Which football team does Lewis Young's older brother, Ashley Young, play for?",Premier League club Manchester United and the England national team
618,What album starring Ed Sheeran was released on 3 March 2017?,"÷ (pronounced ""divide"") is the third studio album by English singer-songwriter Ed Sheeran."
619,What nationality was the lover of Lord Alfred Douglas ? ,Irish
620,"Which band included more previously-known figures when it was formed, !!! or Puddle of Mudd?",!!!
621,Edward C. Hugger and Alexander Acosta served at appointees for what job?,Secretary of Labor
622,What man is linked to both Johnny Tremain and Magic Kingdom?,Walt Disney
623,What drum machine was introduced in 1989 and allowed 32 notes to be played simultaneously?,The R-8 Human Rhythm Composer
624,"What characteristic meaning it's transferable between species, does monkeypox and cowpox virus both share?",zoonotic
625,Near what ocean does the highway carried by the Long-Allen bridge terminate near?,the Atlantic Ocean
626,"The song ""Medicine"" by The 1975 appears in a film directed by what Danish filmmaker?",Nicolas Winding Refn
627,Which member of Odd Future also had a guest appearance on the album too Cozy?,Frank Ocean
628,"What two shows is the director of the first ""Clone Wars"" series known for creating?","""Dexter's Laboratory"", ""Samurai Jack"""
629,Who is the son of John Button under contract with as a driver?,McLaren-Honda
630,"What person, known also as Jane Ryan, has a four lane highway in the Philippines name after her? ",Imelda Marcos
631,"Which band was formed first, Wire or Young the Giant?",Wire
632,Do Cathy Berberian and Dickran Tevrizian share the same profession ?,no
633,What occupation do Chris Menges and Aram Avakian share?,director
634,Who is the film dedicated to that Paramount Classics and MTV Films co-purchased the rights to?,Sam Phillips
635,"Who was the murderer sent to ""Old Smokey"" for allegedly commiting ""The Crime of the Century""?",Richard Hauptmann
636,Nostie lies a short distance from one of Scotland's popular tourist attractions a small tidal island dominated by a picturesque castle that frequently apperas in what?,"photographs, film and television"
637,Which producer from the 2015 British documentary film about the life and death of British singer-songwriter Amy Winehouse also worked on the film Oasis: Supersonic as a film producer?,James Gay-Rees
638,What is the name of the conditions that the radiologist who served as chief of radiology at the U.S. Army's flagship medical center from 1909 to 2011?,Hampton's hump and Hampton's line
639,"Considered the strongest recorded tropical cyclone, which cyclone had a film made about it in 2007?",1999 Odisha cyclone
640,Who was the opponent of the Republican of Indenosia when Nugroho Notosusanto served as a member of the Student Army,the Dutch Empire
641,What intrusment did Jem Finer play in the band The Pogues?,banjo player
642,Who directed the movie for which Jason O'Bryan was nominated for a grammy for best soundtrack?,Alfonso Cuarón
643,"What single was released by a American country singer, songwriter and multi-instrumentalist on MCA Nashville in 2000?",Feels Like Love
644,Are Broughtonia and Laeliocattleya both orchids?,yes
645,Christopher Oscar Pena was recognized by an entertainment-industry brand aimed at what?,people working in film and the performing arts
646,what are the low sea stacks in the Shetland Islands called?,Ramna Stacks
647,"When was the American singer, songwriter, actress and LGBT rights activist born who won Grammy and Emmy award?","June 22, 1953"
648,What vocalist and pianist was recorded by Modular Recordings?,Karen O
649,The design team for role playing game Black Crusade featured the work of this designer who was the lead developer for what game?,Dark Heresy
650,"What ""God Gave Me You"" artist wrote the song ""Imagine That"" for Diamond Rio?",Bryan Shelton White
651,"Which games, Strange Synergy or Qwirkle,  is a card game published by Steve Jackson Games?",Strange Synergy
652,"Which author lived longer, Nelson Algren or Nathanael West?",Nelson Algren
653,"Which space mission did the man, in which the Onizuka Prop Wash Award is named after, perish?",STS-51-L
654,"How long does the lower level degree program, offered at Helene Fuld College of Nursing, typically last?",two years
655,"What band formed in 1995 and came out with an album called ""Welcome Interstate Managers'?",Fountains of Wayne
656,"what air force based named in honor of Carl Benjamin ""Ben"" Eielson is located 26 miles southeast of Fairbanks, Alaska?",Eielson Air Force Base
657, where is the American professional basketball team which Jalen Jones played for based,Louisiana.
658,Sebastian Gutierrez is known for writing the screenplay for the 2003 film directed by whom?,Mathieu Kassovitz
659,Roxie Hart starred the entertainer and comedic actor who had what nickname?,The King of Chutzpah
660,"What festival is held every June in Bartlesville, Oklahoma?",OK Mozart
661,What is the name of the executive producer of the film that has a score composed by Jerry Goldsmith?,Ronald Shusett
662,"What is the scientific name of the true creature featured in ""Creature from the Black Lagoon?",Eucritta melanolimnetes
663,Which KaBoom! Entertainment Inc. film is based on a story by Rudyard Kipling?,The Jungle Book (1894)
664,Have tennis players Françoise Dürr and Mate Pavić both won a doubles title?,yes
