id,question,answer
214,"What is the main industry of this town with a population of around 2,600 as of 2010 that has Mountain Valley High School attendees as residents?",papermaking industry
215,"Who won the 2007 Copa America Final, with help from Julio Baptista?",Brazil
216,"The 1974 Texas Tech Raiders football team represented what public research university in Lubbock, Texas?",Texas Tech University
217,Which British Indian novelist and essayist did Anthony Burgess address in a lengthy letter?,Salman Rushdie
218,Are Daryl Hall and Gerry Marsden both musicians?,yes
219,What basketball player elected to the National Collegiate Basketball Hall of Fame released music through Rendezvous Music?,Wayman Tisdale
220,"Gail Matthius co-anchored the Weekend Update segment of ""Saturday Night Live"" with the actor who played the villain Nicholas Andre in what movie?",Dumb and Dumber
221,Are University of Virginia and Massachusetts Institute of Technology in the same country?,yes
222,In which county does the United States Navy air base located in which  Attack Squadron 174 (VA-174) was based on?,Duval County
223,Were Basil Dean and Francis Ford Coppola both alive at some point in time?,yes
224,Where is the seminar Jeanne Marie Beaumont directed in 2007-2010 located?,"Franconia, New Hampshire"
225,Which  Australian singer-songwriter wrote  Cold Hard Bitch,"Nicholas John ""Nic"" Cester"
226,"Did Qionghai or Suining  have a population of 658,798 in 2002? ","In 2002, Suining had a population of 658,798."
227,"What Province in Sicily, founded in the eighth century B.C., was the birthplace of the famous historical mathematician Archimedes?",Province of Syracuse
228,"What was the population during the 2000 census of the town in Sagadahoc County, Maine that had a population of 3,411 during the 2010 census?","1,864"
229,"How does this series represent a function, which is also used in the Homotopy analysis method?",infinite sum of terms
230,"The Company They Keep is a book written by Diana Pavlac Glyer, who is a professor at a university in Azusa, California, that was founded in 1899, and is under the auspices of what religion?",evangelical Christian
231,Who was the Goal keeper for Iraq in the 1996 AFC Asian Cup played in the United Arab Emirates?,Emad Hashim
232,The On Tour Forever album gave Blues Traveler the opportunity to display what musical trademark?,extensive use of segues
233,"What was the real name of the author of the book ""Coraline"" has been compared to?",Charles Lutwidge Dodgson
234,Who resides in the palace that was the inspiration for the Kensington System's name?,British Royal Family
235,"What German medium tank, sometimes called the ""Mark V"", that was deployed on the Eastern and Western fronts from mid-1943 provided the armor and suspension for the chassis of the tank destroyer built by Nazi Germany during World War II?",The Panther
236,Siegfriedstellung in the First World War was a defensive position of what country's army?,German
237,Evan Williams played for what professional football club that was originally known as St. Luke's FC?,Wolverhampton Wanderers Football Club
238,How many times has the national team Joseph Raich Garriga played for in 1941 participated in FIFA World Cups?,14
239,Little Brown Stein is a rivalry trophy that imitates a mug made out of what item?,stoneware
240,Davey Brozowski is a percussionist for a band that formed in what city in Washington?,Issaquah
241,In which town was the amusement park that is operated by Britannia Jinky Jersey Ltd located where the first  Tomorrow's Parties Festival was held?.,Camber Sands
242,How many episodes were there of the TV series where Julianna Margulies had the role of Carol Hathaway ?,331 episodes
243,"In the Cherokee Rose episode of ""The Walking Dead,"" the character that continues to search for Sophia Peletier is portrayed by an actor who is also famous for his work in what company's advertisements?",Prada
244,What street was the adult entertainment district of the Liberty Tree District centered on?,Washington Street
245,Kevin Rowland and Lauri Ylönen both share what occupation?,singer-songwriter
246,"What was the name of the publisher who published ""Finnegans Wake"" in 1939 by James Joyce",Teriade
247,In which city are the headquarters of the American research and scientific development company where Ravi Sethi worked as computer scientist located?,Murray Hill
248,Which company used a voice actor who also voiced He-Man?,9Lives
249,The Death Camp of Tolerance is an episode from an animated television series that was created by which two people?,Trey Parker and Matt Stone
250,What product by FLEXcon represents data by geometric patterns?,Barcodes
251,"Although Michael Fincke's record was broken by Scott Kelly, commander of the International Space Station (ISS) on Expeditions 26, 45, and 46, what was his record for the most time in space?",381.6 days
252,Does the genus Cunninghamia or Chilopsis contain only one species?,Chilopsis
253,What type of veterinary specialist is the star veterinarian of The Bionic Vet?,neuro-orthopaedic
254,What is the official currency in the country that hosts the Asahi-Ryokuken Yomiuri Memorial tournament?,yen
255,"In which genus number of species are more, Lavatera or Oplismenus?",Oplismenus
256,Who was the pivotal in the formation of schools catering for the primary and early secondary education of children in remote and outback Australia?,Adelaide Laetitia
257,"Which plant genus is part of a family with a longer name, Morning glory or Rothmannia?",Morning glory
258,"What american singer,had Warren Fu as one of their video directors, and also had to face allegation of illegal marriage with R. Kelly?",Aaliyah
259,Harry Emerson Fosdick was called to serve as pastor at a church that opened its doors on what date?,"October 5, 1930"
260,"Jennifer Gordon received a bachelor of arts degree from which women's liberal arts college in Cambridge, Massachusetts, and functioned as a female coordinate institution for the all-male Harvard College?",Radcliffe College
261,Which CEO of FedEx becked  Value America ,"Frederick Wallace ""Fred"" Smith"
262,Which American pro basketball player who won gold at the 2008 Summer Olympics was signed by the Utah Jazz during the 2005-05 offseason?,Carlos Austin Boozer Jr.
263,Mazda's Mazda6 belongs to which country's car manufacturer?,Japanese
264,"What is the name of the detective novelist parent of the author of '""Q"" Is for Quarry'?",C. W. Grafton
265,"What is the name of the genocidal mass slaughter of Tutsi Rwanda, in which Cyprian and Daphrose Rugamba were assassinated?",Rwandan genocide
266,"When did the English local newspaper, featuring the sculpture and war memorial in the Forbury gardens, change names?",2009
267,What Congressional District did John Shimkus represent before the 20th Congressional District of Illinois?,Illinois 's 15 congressional district
268,WHat dish is  Dacryopinax spathularia included in that is also sometimes called Luóhàn cài?,Buddha's delight
269,"Which came to market first, ""Hey Pa! There's a Goat on the Roof"" or ""Poleconomy""",Hey Pa! There's a Goat on the Roof
270,What is the name of the record label owned by one of the three artists responsible for creating the 1993 album Honky Tonk Angels?,Dolly Records
271,"Who produced the 1998 British comedy starring the director of the feature film ""Eddie the Eagle""?",Matthew Vaughn
272,"In 2008, who were the two actors stared along with a South Korean actor, singer, and model who won best actor in five prestigious award ceremonies.",Best Actor prize
273,"Which was founded first, Dain Rauscher Wessels or Berenberg Bank?",Dain Rauscher Wessels
274,Are Castor et Pollux and Manon Lescaut composed by the same people?,no
275,Orchard Gateway connects what shopping mall in singapore with 313 @ Somerset?,Orchard Central
276,Which is the younger brother in the composer duo that composed Aati Kya Khandala?,Lalit
277,Shannon Purser played the role of June Acosta in a 2017 horror film directed by who?,John R. Leonetti
278,How many Studio albums did the group that released the debut album The Cactus Al/Bum release in their initial career?,two studio albums
279,"What was the nickname of Anthony Corallo, boss to ""Sal"" Avellino and head of the Lucchese mob family mob in New York?",Tony Ducks
280,Is Chicago Rockford International Airport or McClellan–Palomar Airport closer to their nearest cities?,McClellan–Palomar Airport
281,"Between The Goldeneye and Monkey Gland, which cocktail requires more ingredients?",Monkey Gland
282,Mexican Indignados Movement is a response to a war also known as?,Mexican War on Drugs
283,Are either Edward H. Griffith or Edward Burns from Germany?,no
284,What year did the shopping centre on the street numbered B411 open in the space of in the retail space of the former William Whiteley Limited department store?,1989
285,Who was hung for assisting the attempted surrender of a defector from the American Continental Army to the British Army?,John André
286,What is Peter Daou's website's slogan?,"""media for the 65.8 million,"""
287,"Human Shadow Etched in Stone is an exhibition to showcase which bombing that killed 129,000 people in 1945?",Hiroshima and Nagasaki
288,"What is Opry Mills in Nashville, Tennessee?",super-regional shopping mall
289,Which them park is host to both the Back to the Future Rid and The Simpsons Ride?,Universal Studios Florida
290,What was the benefit of reintroducing piston power and replacing the most popular turboprop engine in history?,much better fuel economy
291,The languages Hussein Ali Mahfouz studied are spoken by how many people?,more than 330 million people
292,"when the Marlins are the home team, games are played at this park which was LEED certified as the greenest MLB park in what year?",2012
293,Who is the Mexican actor that starred in Sex and Breakfast?,Eduardo Kuno Becker Paz
294,Australian Associated Press was established by a journalist born in which year ?,1885
295,Which season did Brain Billick coach the Baltimore Ravens though in 2001?,6th season
296,Henry W. Bloch School of Management is named after the founder of an American tax preparation company that is based where?,Kansas City
297,Hate Them is the ninth album by a band likened to who?,Motörhead
298,What was the population in 2016 of the city that Norman Foote is originally from?,"631,486"
299,Which actor in the film Equus is also in the film The Informers?,Colin Blakely
300,Firstar Center was the name for two buildings before the company changed its name to match which company based in Minneapolis?,U.S. Bancorp
301,Which services did Rock Nominees Ltd and  ISS A/S (Integrated Service Solutions) have in common?,"cleaning, catering and security"
302,The most principle species of plants which requires an ericaceous type of compost can have what effect on its surroundings because of the way it takes up cations?,Peat moss can also acidify its surroundings by taking up cations
303,"The man, who the award in which ""Summer of the Monkeys"" won, was a spokesman for white sector of America?",middle America
304,Who is younger Jenny Bae or Lionel Richie ?,Jenny Bae
305,"The album ""The Best of LeAnn Rimes"" contained a song used as the theme song for a film. What is the name of the film?",Coyote Ugly
306,What division of Mexican football is the team that Jesús Daniel García Esparza currently plays for?,Liga MX
307,What is the are of the university at which Dick Biddle served as head football coach?,575 acres (2.08 km²)
308,What is the seventh book of the Hebrew and Christina bible and also has Quran references to the river drinking experience?,Book of Judges
309,"What are the letters of the radio station serves the area comprising all of Belknap County, among others?",WANH
310,"""This Ole House"" topped the UK chart in 1981 in a recording by a platinum-selling British rock and roll singer whose recording and performing career began when? ",in the late 1960s
311,Which Prince of Bismarcks EMS dispatch incited France to declare the Franco-Prussian War in July 1870,Otto Eduard Leopold
312,What is the original name of the place where The 1st Minnesota Light Artillery Battery mustered?,Fort Saint Anthony
313,What man with a lazy left eye starred in Sacred Ground?,Jack Elam
314,When was the magazine Sam Duckworth got his name Get Cape. Wear Cape. Fly from launched?,January 2004
315,The 2017–18 Wigan Athletic F.C. season will be a year in which the team competes in the league cup known as what for sponsorship reasons?,Carabao Cup
316,What 2003 Christmas-themed romantic comedy did Gregor Fisher have a role in?,Love Actually
317,In what year did a movie that starred both Nicholas Cage and Cher come out? ,1987
318,"What is the original surname for the actor who sang ""It's a De-Lovely"" in the 1962 revival of ""Anything Goes""?",Lipshitz
319,"What is the year of the event that occured first, Making Today a Perfect Day was produced, or Frozen was produced?",2013
320,A relative of the emu is native to which continent?,Africa
321,"Who directed the film that had ""The Distance"" in the soundtrack?",Peter Chelsom
322,"Swiss music duo Double released their best known single ""The Captain of Her Heart"" in what year?",1986
323,Did Lewis Allen or Danny DeVito play Louie De Palma?,"Daniel Michael DeVito, Jr."
324,The father of Manning Marius Kimmel retired from the Navy in what year?,1942
325,What award did Flossie Bailey receive that was named after the first female self-made millionaire in America?,Madam C. J. Walker
326,Castle Hill is a plantation near what primary residence of Thomas Jefferson?,Monticello
327,Toyota Innova is part of the IMV program along with which light commercial vehicle?,Hilux
328,Were Ilya Ehrenburg and Harold Robbins both translators?,no
329,"What is unique about the forum an American poet, memoirist, and civil rights activist spoke at?",oldest free public lecture series
330,Who graduated from The SC Bastia Reserves and Academy  and was born 9 September 1987?,Alexandre Dimitri Song Billong
331,The Hong Kong Museum of Coastal Defence is located on an island with a population of what?,"1,289,500"
332,Friedrich Ratzel coined the phrase Lebensraum; which political movement made it notorious by taking it to extremes?,the Nazi Party
333,Which How to Steal a Million actor attended the Royal Academy of Dramatic Art?,Peter O'Toole
334,Which former mill town is near Rivington Hall Barn?,Bolton
335,What 4-D film attraction at Walt Disney World is based off a 2004 computer-animated Christmas movie? ,Mickey's PhilharMagic
336,Do Singapore Sling and Fish House Punch both contain alcohol?,yes
337,"What is the name of the range of characteristics pertaining to, and differentiating between, masculinity and femininity which Mary Karooro Okurut was appointed to in 2012 as Minister of?",Gender and Social Issues
338,What is the name of the number-one single featuring the winner of Celebrity Apprentice 3?,Every Rose Has Its Thorn
339,Four presidents including the 26th president Theodore Roosevelt were featured in the 60ft sculpture in the granite face of Mount Rushmore which was sculpted by what sculptor?,Sculptor Gutzon Borglum
340,The Northern Circuit dates from a year when a King of England married to whom sent his justices on circuit?,Eleanor of Aquitaine
341,"Which movie was released first, Return to Oz or Midnight Madness?",Midnight Madness
342,Which retired Argentine footballer who played as a forward was a main player for Valencia CF?,Claudio Javier López
343,What type of believer does Mir Jafar Baghirov and Joseph Stalin have in common?,communist
344,Jared Has Aides was about the spokesperson for which company?,Subway
345,Are Anja Salomonowitz and Rod Lurie both directors?,yes
346,Which date occurred first the end of Riley Hawk's amateur career or end of production of Skateboard Magazine ?,"October 15, 2013"
347,What public radio network in New York has allowed Eric Plakun to dis his psychiatric work?,WAMC
348,Taylor Momsen and Craig Mabbitt from Escape the Fate have what in common?,lead singer
349,"Les Ottolenghi was previously the Chief Information Officer at what casino in Paradise, Nevada?",Las Vegas Sands
350,In what year was Shin Hyun-joon in the successful South Korean comey sequel?,2005
351,Which New Jersey-based manufacturer of suitcases and bags for travel is located in the Shops at Columbus Circle in New York City?,"Tumi Holdings, Inc."
352,Where was the original line of the railroad William Howard worked for?,the port of Baltimore west to Sandy Hook
353,The author of Sexual Politics attended which British University?,Oxford
354,Li Yitong played Huang Rong is a tv series directed by who?,Jeffrey Chiang
355,"How many major novels did the author write, whose 1811 book was adapted for a 2008 film with a screenplay by Andrew Davies ?",six
356,"What aviator participated to the Transatlantic flight organized by the ""heir apparent"" to Italian dictator Benito Mussolini?",Antonio Lippi
357,Which mechanical device which engages and disengages power transmission  uses brake fluid?,hydraulic clutch
358,"Between Gareth Evans and Pierre Chenal, who's had a more diver career?",Gareth Huw Evans
359,Pablo Jose Ozuna is the cousin of a Dominican professional baseball left fielder who made his MLB debut in what year?,2013
360,"Who is Bruce Spizer an expert on, known as the most influential act of the rock era?",The Beatles
361,"How many records had the team sold before performing ""aint thinkin' 'bout you""?",three million copies worldwide
362,Which American politician who served as United States Senator from 1971 to 1989 was Governor of Florida before Buddy MacKay?,Lawton Chiles
363,What year did a director of a North Korean cinema film get kidnapped?,1978
364,"Who achieved more academically, Andrea Martin or Mark Hoplamazian? ",Mark S. Hoplamazian
365,"Toby Scott worked with which American singer born on May 24, 1941?",Bob Dylan
366,Where is the head quarter of the Blue Bird Body Company?,"Fort Valley, Georgia"
367,Are Waco Regional Airport and Idaho Falls Regional Airport both city owned airports?  ,yes
368,Where was the university at which  Barrie Ciliberti was a professor located? ,"Prince George's County, Maryland"
369,"Which has more species, Festuca or Dactylis?",Festuca
370,Which building is taller Bertelsmann Building or 432 Park Avenue?,432 Park Avenue
371,Are both American Foxhound and Löwchen types of Foxhounds?,no
372,"Which facility was founded in Missouri, Discovery Zone or Valentino's?",Discovery Zone
373,"What is the name of the daughter of the Irish entertainer in the girl band Maxi, Dick and Twink?",Chloë Alexandra Adele Emily Agnew
374,"Which Kevin Costner movie included an actor who also starred in ""Little Big League""?","""Field of Dreams"""
375,Who was the director of 2004 American teen comedy adventure film in which Michelle Christine Trachtenberg appeared?,Schaffer
376,Japanese destroyer Oite participated in what conflict that ended with the surrender of the American forces to the Empire of Japan?,Battle of Wake Island
377,Christopher de Haro provided the financial backing to what Portuguese explorer who organised the Spanish expedition to the East Indies from 1519 to 1522? ,Ferdinand Magellan
378,Falling Stars is a role-playing game published by the company based out of what country?,Lithuania
379,The Zapruder film shows President John F. Kennedy's motorcade as it passed through a plaza that was named aNational Historic Landmark in what year? ,1993
380,"Who lived longer, Tony Richardson or Giorgio Ferroni?",Giorgio Ferroni
381,Are Water dropwort and Costus both in the family Apiaceae?,no
382,Gerd Neggo trained under the founder of which type of dance analysis?,Laban Movement Analysis
383,What is the population of the town that gets it's water supply from Canobie Lake?,"28,776 at the 2010 census"
384,"Who has released more studio albums, Candlelight Red or Motion City Soundtrack?",Motion City Soundtrack
385,Who wrote the 1970 international hit song Murray Head is most recognized for?,Andrew Lloyd Webber and Tim Rice
386,"Where is the singer of ""B Boy"" raised?",Philadelphia
387,The major benefactor who donated money to build Archbold Gymnasium sold his oil company to whom?,John D Rockefeller's Standard Oil Company
388,Me and You and Everyone We Know was directed by an artist who also directed what 2011 film?,The Future
389,"What role did the actor who played Colonel Sherman T. Potter in ""M*A*S*H"" play in ""Kentucky Jones""",Seldom Jackson
390,The owner of radio station KWPW has the same name as an American character actor. What is it?,Bill McCutcheon
391,George Tawengwa was the first black person to buy a farm located in a country now known as which country ?,Zimbabwe
392,"Which film was released first, Home on the Range or Pete's Dragon?",Home on the Range
393,Command and Control was a book that discusses the 1980 incident in what state?,Arkansas
394,The host of PokerFace is from where?,"Newcastle upon Tyne, England"
395,"Of which painting was this German dancer, actress, and writer who lived during the Weimar period and appeared in the 1918 German silent drama film ""The Story of Dida Ibsen"" the subject?",an Otto Dix painting
396,"In the USA, gun powder is used in conjunction with this to start the Boomershot.",Anvil firing
397,"What resort in Biloxi, Mississippi does the Chief Operating Officer of the largest single hotel in the United States oversee?",Beau Rivage
398,What park is just south of the location where the New York Jets played prior to moving to Shea Stadium? ,Central Park
399,Who directed the film where Susanne Pollatschek voiced Olivia Flaversham?,"Burny Mattinson, David Michener, and the team of John Musker and Ron Clements"
400,Did both  Slaughter-House Cases and United States v. Darby Lumber Co. involve civil rights law?,no
401,Where did Cale Gundy's brother play football in college?,Oklahoma State University
402,Who constructed Auburn the Antebellum mansion and was accused of the Manhattan Well Murder?,Levi Weeks
403,"Which dog originated in Galicia, the Bullenbeisser or Can de Palleiro?",Can de Palleiro
404,"Shane and Friends have interviewed an American YouTube personality who has two active YouTube channels, which have a combined total of how many views?",1.7 billion
405,"""52nd Street"" is a 1978 album that earned two Grammy Awards for which piano-playing songwriter?",Billy Joel
406,Who preceded the man who had the Nassak Diamond cut and placed into the handle of his sword?,1st Earl Grosvenor
407,What other jobs did the man that co-produced Gyara Hazar Ladkian have?,film lyricist
408,Pyotr Verzilov is married to a Russian conceptual artist and what kind of activist?,political
409,Which American band from Knoxville Tennessee released the album From Birth to Burial?,10 Years
410,Renáta Tomanová and Larisa Neiland are former professional athletes for what sport?,professional tennis
411,What is in both the Lithocarpus and Duranta species?,trees
412,What medieval fortress is believed to refer to a chapel at the bottom of a hill?,Bonkyll Castle
413,"When was the Russian composer who composed ""Prisoner of the Caucasus"" born? ",[O.S. 6 January] 1835
414,The eighth-longest rollercoaster in the world is located in what theme park?,Disney California Adventure
415,What religion is the composer for India's first science fiction film series?,Hindi
416,"Which feature film was released earlier, One Magic Christmas or Muppet Treasure Island?",One Magic Christmas
417,"Who was also an actor, Serri or John Fogerty?",Serri
418,In which Sottish Region is the castle in which] Sir Roger de Kirkpatrick was born ?  ,"Dumfries and Galloway,"
419,"When was the American actor, film director which  Dana Brunetti is the president of his company born ","July 26, 1959"
420,"Which building, the Metropolitan Life Insurance Company Tower or the 432 Park Avenue building, has two addresses?",Metropolitan Life Insurance Company Tower
421,Who was born first out of Leopold Lummerstorfer and Laurent Touil-Tartour?,Leopold Lummerstorfer
422,Which conflict involving the Mende ethnic group lasted for eleven years?,Sierra Leone Civil War
423,Are Des Moines International Airport and Grand Canyon National Park Airport both major airline hubs?,no
424,"Often seen at the Academy Awards pre-show, what is Robin Roberts's occupation?",American television broadcaster
425,"What is the name of this suburb within the Central Coast Council local government area, where Tessa, of Microwave Jenny, grew up?","Umina Beach, New South Wales"
426,Sum 41 and Passion Pit have what in common?,Passion Pit is an American indietronica band
427,"What is the founding year of this public research university in the Netherlands, where Jan Borgman was a professor from 1968 to 1988?",1614
428,To Catch a Predator was devoted to impersonating people below the age of consent for which in North America varies by what?,jurisdiction
429,Whistle and Yodel both specialize in what service?,delivery service company
430,This One's for the Children had lead vocals by the singer and songwriter of what nationality?,American
431,"Flynn Rider is voiced by which American actor and singer born September 29, 1980?",Zachary Levi
432,What was the position in the United States Army of the Lieutenant general that Confederate General Robert E. Lee surrendered to?,Commanding General
433,Who was the ruler ousted by the 30th Prime Minister of Cambodia after Khmer Rouge's victory over the Lon Nol government?,Prince of Cambodia Norodom Sihanouk
434,"Who was born more recently, Flula Borg, or Dirk Nowitzki?",Flula Borg
